{"schemaVersion":1,"ok":true,"meshRevision":null,"sessionRef":{"hostId":"local","serverGeneration":"tmux-v1:1722741000:1234:/run/user/1000/tmux-1000/default","sessionId":"$6","createdAt":1722742000},"status":"verified","viewers":[{"viewerId":"tv1_aaaaaaaaaaaaaaaaaaaaaaaaaaaaaaaaaaaaaaaaaaa","windowId":102}],"closeSafe":true}
